{
  "decision": "SHIP",
  "experiment": "jcs-edge 😀",
  "expgate_version": "0.2.0",
  "input": {
    "arms": {
      "control": {
        "metrics": {
          "～": {
            "mean": 40.0,
            "sd": 12.5
          },
          "😀": {
            "mean": 1e-07,
            "sd": 3e-07
          }
        },
        "units": 20000
      },
      "treatment": {
        "metrics": {
          "～": {
            "mean": 40.5,
            "sd": 12.5
          },
          "😀": {
            "mean": 2e-07,
            "sd": 3e-07
          }
        },
        "units": 20000
      }
    },
    "description": "Escapes and non-ASCII text: <&>   é 😀 / \" \\ \u0007",
    "experiment": "jcs-edge 😀",
    "metrics": {
      "～": {
        "direction": "increase",
        "role": "primary",
        "type": "mean"
      },
      "😀": {
        "direction": "decrease",
        "margin": 5.0,
        "role": "guardrail",
        "type": "mean"
      }
    },
    "seed": 7
  },
  "input_sha256": "1316835817c4cfec2fed001a9aac9f7029d02bd75386c69b6e2b58f1c0d305eb",
  "metrics": [
    {
      "control": 40.0,
      "diff": 0.5,
      "direction": "increase",
      "improvement": 0.5,
      "improvement_bounds": [
        0.29439329663106595,
        0.705606703368934
      ],
      "mde": 0.31080935756554834,
      "mde_basis": "fixed_horizon_normal_approximation",
      "metric": "～",
      "role": "primary",
      "se": 0.125,
      "status": "IMPROVED",
      "treatment": 40.5,
      "type": "mean",
      "z": 1.6448536269514722
    },
    {
      "control": 1e-07,
      "diff": 1e-07,
      "direction": "decrease",
      "improvement": -1e-07,
      "improvement_bounds": [
        -1.0493456088085442e-07,
        -9.506543911914558e-08
      ],
      "margin": 5.0,
      "mde": 7.45942458157316e-09,
      "mde_basis": "fixed_horizon_normal_approximation",
      "metric": "😀",
      "role": "guardrail",
      "se": 3e-09,
      "status": "NON_INFERIOR",
      "treatment": 2e-07,
      "type": "mean",
      "z": 1.6448536269514722
    }
  ],
  "policy": {
    "alpha": 0.05,
    "power": 0.8,
    "srm_alpha": 0.001
  },
  "produced_by": {
    "name": "expgate",
    "version": "0.2.0"
  },
  "reasons": [
    "primary metric improved and all guardrails are non-inferior"
  ],
  "sample_ratio": {
    "control_units": 20000,
    "expected_treatment_share": 0.5,
    "p_value": 1.0,
    "pass": true,
    "treatment_units": 20000
  },
  "schema_version": 3
}