{
  "decision": "INVALID",
  "experiment": "srm",
  "expgate_version": "0.2.0",
  "input": {
    "arms": {
      "control": {
        "metrics": {
          "conversion": {
            "successes": 2835
          },
          "latency_ms": {
            "mean": 40.026957,
            "sd": 12.035181
          },
          "refund_rate": {
            "successes": 567
          }
        },
        "units": 28200
      },
      "treatment": {
        "metrics": {
          "conversion": {
            "successes": 3561
          },
          "latency_ms": {
            "mean": 39.880188,
            "sd": 11.983383
          },
          "refund_rate": {
            "successes": 629
          }
        },
        "units": 31800
      }
    },
    "assignment": {
      "expected_treatment_share": 0.5
    },
    "description": "Assignment bug sends 53% of traffic to treatment",
    "experiment": "srm",
    "metrics": {
      "conversion": {
        "direction": "increase",
        "role": "primary",
        "type": "proportion"
      },
      "latency_ms": {
        "direction": "decrease",
        "margin": 2.0,
        "role": "guardrail",
        "type": "mean"
      },
      "refund_rate": {
        "direction": "decrease",
        "margin": 0.003,
        "role": "guardrail",
        "type": "proportion"
      }
    },
    "seed": 20260924
  },
  "input_sha256": "574716cc37d01b1fa448f5661e642c59785860651e6bd263d7dabf7573b05a50",
  "metrics": [
    {
      "control": 0.10053191489361703,
      "diff": 0.011449217181854668,
      "direction": "increase",
      "improvement": 0.011449217181854668,
      "improvement_bounds": [
        0.007309654268178323,
        0.015588780095531014
      ],
      "mde": 0.006257650498355854,
      "mde_basis": "fixed_horizon_normal_approximation",
      "metric": "conversion",
      "role": "primary",
      "se": 0.002516675554498123,
      "status": "IMPROVED",
      "treatment": 0.1119811320754717,
      "type": "proportion",
      "z": 1.6448536269514722
    },
    {
      "control": 40.026957,
      "diff": -0.14676900000000614,
      "direction": "decrease",
      "improvement": 0.14676900000000614,
      "improvement_bounds": [
        -0.045788235798067345,
        0.33932623579807963
      ],
      "margin": 2.0,
      "mde": 0.2752425604285646,
      "mde_basis": "fixed_horizon_normal_approximation",
      "metric": "latency_ms",
      "role": "guardrail",
      "se": 0.09824529293239082,
      "status": "NON_INFERIOR",
      "treatment": 39.880188,
      "type": "mean",
      "z": 1.9599639845400538
    },
    {
      "control": 0.020106382978723403,
      "diff": -0.0003265087648869243,
      "direction": "decrease",
      "improvement": 0.0003265087648869243,
      "improvement_bounds": [
        -0.0019153696135003622,
        0.0025683871432742107
      ],
      "margin": 0.003,
      "mde": 0.003204555479202245,
      "mde_basis": "fixed_horizon_normal_approximation",
      "metric": "refund_rate",
      "role": "guardrail",
      "se": 0.001143836517441615,
      "status": "NON_INFERIOR",
      "treatment": 0.01977987421383648,
      "type": "proportion",
      "z": 1.9599639845400538
    }
  ],
  "policy": {
    "alpha": 0.05,
    "power": 0.8,
    "srm_alpha": 0.001
  },
  "produced_by": {
    "name": "expgate",
    "version": "0.2.0"
  },
  "reasons": [
    "sample-ratio mismatch (p=6.74e-49 < 0.001)"
  ],
  "sample_ratio": {
    "control_units": 28200,
    "expected_treatment_share": 0.5,
    "p_value": 6.744057652239356e-49,
    "pass": false,
    "treatment_units": 31800
  },
  "schema_version": 3
}